external_id,title,short_title,description,category,tags,start_datetime,end_datetime,venue_title,venue_address,venue_lat,venue_lon,price_min,price_raw,is_free,age_restriction,image_url,site_url,source,parsed_at
,В свечах: Шедевры классики в особняке Половцова,В свечах: Шедевры классики в особняке Половцова,"Цикл событий #В_СВЕЧАХ от команды Русские Музыкальные Сезоны превращает самые красивые и необычные залы Петербурга в уютные концертные площадки, наполняя пространство залов тёплым светом тысячи свечей, что создаёт неповторимую атмосферу и идеальный фон для музицирования.

Один из самых роскошных дворцовых залов Петербурга, белый зал Особняка Половцова в этот вечер наполнится звуками вечной, популярной классической музыки таких композиторов, как П.И. Чайковский, А. Вивальди, Ж. Массне, И. Бах, С.В. Рахманинов и др.

Приготовься устроиться поудобнее и насладиться самыми яркими шедеврами мира классической музыки в виртуозном исполнении артистов крупнейших театров Петербурга в свечах.

Экскурсия-проход по парадным залам оплачивается дополнительно к билету по желанию и наличию. Начало экскурсии за час до начала концерта.

В программе:
22 мая — Французский шарм шедевров классики
25 мая — Прелюдия лета
3 июня — Новая классика
8 июня — Французский шарм шедевров классики
12 июня — Великая класс",other,,"В свечах: Шедевры классики в особняке Половцова в городе Санкт-Петербург, до 27 августа 2026: купить билеты — Кавёр",,,,,,3000,3000 руб,False,0+,https://kaverafisha.ru/__og-image__/image/saint-petersburg/events/vsvechah-shedevry-klassiki-v-osobnyake-polovtsova-264817/og.png,https://kaverafisha.ru/saint-petersburg/events/vsvechah-shedevry-klassiki-v-osobnyake-polovtsova-264817,kaver,2026-07-11 14:03:01
,"Кино, вино и рисование","Кино, вино и рисование","Помнишь то время, когда интернет был медленным, а сериалы — культовыми? Художественная студия «Артиста» предлагает тебе вернуться туда вместе! Приходи смотреть легендарные фильмы и сериалы 2000-х, рисуя акрилом картины в стилистике фильма или со свободным сюжетом.

Вкусный попкорн и кола в подарок каждому гостю. Домашняя атмосфера и любимые киноленты — и вечер удался!

Расписание фильмов можно посмотреть на сайте.",other,,"Кино, вино и рисование в городе Санкт-Петербург, до 26 июля 2026: купить билеты — Кавёр",,,,,,3650,3650 руб,False,0+,https://kaverafisha.ru/__og-image__/image/saint-petersburg/events/kino-vino-i-risovanie-306096/og.png,https://kaverafisha.ru/saint-petersburg/events/kino-vino-i-risovanie-306096,kaver,2026-07-11 14:03:04
,Стакан «Ледяная хрупкость»,Стакан «Ледяная хрупкость»,"Заморозь время в стекле! Попробуй мастер-класс по стеклодувному искусству, где ты научишься выдувать стакан с эффектом треснувшего льда.

На мастер-классе происходит выдувание раскалённой массы стекла через трубку в специальную форму. Ты сможешь выбрать форму стакана: многогранник, круглый или квадратный. Цвет изделия — прозрачный с вкраплениями цветной крошки на твой выбор.

Изделие ты сможешь забрать через неделю. Все необходимые материалы для стеклодувного мастер-класса, а также чай\кофе и угощения включены в стоимость. Продолжительность 1,5 часа. 


Расписание можно посмотреть на сайте, кнопка «купить билет».",other,,"Стакан «Ледяная хрупкость» в городе Санкт-Петербург, до 31 июля 2026: купить билеты — Кавёр",,,,,,4400,4400 руб,False,0+,https://kaverafisha.ru/__og-image__/image/saint-petersburg/events/stakan-ledyanaya-hrupkost-294270/og.png,https://kaverafisha.ru/saint-petersburg/events/stakan-ledyanaya-hrupkost-294270,kaver,2026-07-11 14:03:06
,Сахаджа йога медитация на Владимирской,Сахаджа йога медитация на Владимирской,"Внимание, событие отменили.

Коллективная медитация для всех желающих. Простая, доступная практика — подходит для новичков и опытных. 

Сахаджа йога — это метод медитации, который позволяет выйти за рамки ментальной, эмоциональной, физической деятельности и почувствовать настоящего себя. На санскрите «сахаджа» означает врожденный, «йога» — союз, поэтому сахаджа йога переводится как «рожденный с тобой союз».

Практика проходит в Livebody club (дом Каншиных). 

Занятие бесплатное, регистрация обязательна.",other,,"Сахаджа йога медитация на Владимирской в городе Санкт-Петербург, 11 июля 2026: купить билеты — Кавёр",,,,,,0,Бесплатно,True,0+,https://kaverafisha.ru/__og-image__/image/saint-petersburg/events/sahaja-yyoga-meditatsiya-na-vladimirskoyy-263775/og.png,https://kaverafisha.ru/saint-petersburg/events/sahaja-yyoga-meditatsiya-na-vladimirskoyy-263775,kaver,2026-07-11 14:03:08
,Киса,Киса,"Что ты знаешь о Кисе Воробьянинове? Наверняка, что этот разжалованный новой властью предводитель дворянства бежал в крохотный город и прятался у тещи. Что от нее узнал тайну о брильянтах в одном из двенадцати стульев и отправился на их поиски вместе с великим комбинатором Остапом Бендером.

Но это только часть его биографии. Истинная личность Кисы, его характер и приключения были безжалостно вырезаны из романа советской цензурой. Запрещенные главы рассказывают, что, оказывается, этот почтенный старец — мот и бонвиван похлеще Бендера. И поиск фамильных ценностей — его последний шанс вернуться к непрерывному кутежу.

Именно об этом, настоящем, Кисе новый спектакль Семена Серзина — одного из лидеров российской режиссуры, известного зрителям «Приюта комедианта» по спектаклю «Смерть Тарелкина».

Продолжительность – 2 ч 30 мин (с антрактом).",other,,"Спектакль Киса в городе Санкт-Петербург, 10 августа 2026: купить билеты — Кавёр",,,,,,800,800 руб,False,0+,https://kaverafisha.ru/__og-image__/image/saint-petersburg/events/kisa-267098/og.png,https://kaverafisha.ru/saint-petersburg/events/kisa-267098,kaver,2026-07-11 14:03:10
,MedioModo-Фест,MedioModo-Фест,"Главный научно-популярный фестиваль имени себя любимого.

Выступят одни из любимых лекторов: антрополог Станислав Дробышевский, автор исторического подкаста Кирилл «Домнин» Буренок и врач Алексей Водовозов.

О чём будем говорить:
Станислав Дробышевский — «Ухо жаброй не испортишь».

На лекции поговорят об эволюционных перипетиях анатомии. То, что кажется нам естественной и само-собой разумеющейся частью нашего тела, в своё время было смелой инновацией, радикально поменявшей жизнь наших далёких предков.

Эти усовершенствования имели совершенно иное назначение, нежели то, что досталось нам по наследству после миллионов лет преобразований. Человек собран из элементов, обеспечивавших жизнь одноклеточных существ, рыб, амфибий, рептилий и первых млекопитающих.

О некоторых из них расскажет Станислав Дробышевский.

Кирилл «Домнин» Буренок — «Историю пишут все подряд».

Как известно, историю пишут победители, все летописи написаны под диктовку правителей и содержат только то, что им было выгодн",other,,"MedioModo-Фест в городе Санкт-Петербург, 15 ноября 2026: купить билеты — Кавёр",,,,,,3300,3300 руб,False,0+,https://kaverafisha.ru/__og-image__/image/saint-petersburg/events/mediomodo-fest-317053/og.png,https://kaverafisha.ru/saint-petersburg/events/mediomodo-fest-317053,kaver,2026-07-11 14:03:12
,Арт-пикник на крыше,Арт-пикник на крыше,"Мастер-класс для туристов, гостей города и влюблённых в рисование местных жителей. 

В гостях у бара «Небо и вино» ты совместишь приятное с полезным: акварельная живопись со стаканчиком лимонада и любимым десертом. Ты сможешь создать акварельную зарисовку с панорамой города и видом на купол Исаакиевского собора формата А5. 

Все материалы: краски, холст или бумага, кисти и напиток + десерт из меню бара входят в стоимость. 

Готовую работу можно забрать в этот же день.
Продолжительность: 2 часа.
Ближайшие даты в июле: 3, 4, 8, 10, 11, 15, 17, 18. Начало в 19:00.",other,,"Арт-пикник на крыше в городе Санкт-Петербург, до 18 июля 2026: купить билеты — Кавёр",,,,,,5300,5300 руб,False,0+,https://kaverafisha.ru/__og-image__/image/saint-petersburg/events/art-piknik-na-kryshe-277493/og.png,https://kaverafisha.ru/saint-petersburg/events/art-piknik-na-kryshe-277493,kaver,2026-07-11 14:03:14
,Дом для зелёного друга,Дом для зелёного друга,"Прояви любовь и заботу к зелёным братьям. Если у тебя дома живёт кактус или суккулент, то этот мастер-класс по лепке авторского кашпо для тебя.

Любая форма, размер, цвет. 

Длительность: 1,5- 2 часа.  

Забрать изделие можно через 5 недель после мастер-класса.  

С подробным расписанием мастер-класса можно ознакомиться на сайте по ссылке.",other,,"Дом для зелёного друга в городе Санкт-Петербург, до 30 июля 2026: купить билеты — Кавёр",,,,,,3500,3500 руб,False,0+,https://kaverafisha.ru/__og-image__/image/saint-petersburg/events/dom-dlya-zelenogo-druga-277197/og.png,https://kaverafisha.ru/saint-petersburg/events/dom-dlya-zelenogo-druga-277197,kaver,2026-07-11 14:03:16
,Стендап вечер,Стендап вечер,"Формат, где опытные комики рассказывают самые свежие и самые проверенные шутки. Самые необыкновенные и самые потрясающие монологи, которые развеселят любого, кто возьмёт билеты для себя и друзей.

Запуск на мероприятие за час до начала.
Рассадка осуществляется менеджером зала в порядке очереди.
Приходи к началу запуска, чтобы занять места ближе к сцене.",other,,"Стендап вечер в городе Санкт-Петербург, 12 июля 2026: купить билеты — Кавёр",,,,,,600,600 руб,False,0+,https://kaverafisha.ru/__og-image__/image/saint-petersburg/events/stendap-vecher-295851/og.png,https://kaverafisha.ru/saint-petersburg/events/stendap-vecher-295851,kaver,2026-07-11 14:03:19
,Блюдо для сервировки в технике фьюзинг,Блюдо для сервировки в технике фьюзинг,"Мастер-класс, на котором ты сможешь сделать идеальное блюдо для украшения твоего стола. Смешаешь цвета, поиграешь с объёмом и получишь единственный в своём роде предмет посуды. Размер тарелки 18х18 см, квадратная.

Изделие будет готово через неделю после мастер-класса. В стоимость входит 1 изделие на выбор. Ты можешь сделать изделие с загнутыми краями, либо плоское. Продолжительность 3 часа. Все необходимые материалы, а также чай\кофе и угощения включены в стоимость. 

Расписание можно посмотреть на сайте, кнопка «купить билет».",other,,"Блюдо для сервировки в технике фьюзинг в городе Санкт-Петербург, до 30 июля 2026: купить билеты — Кавёр",,,,,,3600,3600 руб,False,0+,https://kaverafisha.ru/__og-image__/image/saint-petersburg/events/blyudo-dlya-servirovki-v-tehnike-fyuzing-294275/og.png,https://kaverafisha.ru/saint-petersburg/events/blyudo-dlya-servirovki-v-tehnike-fyuzing-294275,kaver,2026-07-11 14:03:22
,Ахматова. Большой вечер поэзии,Ахматова. Большой вечер поэзии,"Как в юном саду, едва освободившемся от зимних оков, есть в женской поэзии своя непостижимая, но манящая тайна. Секрет, отпирающий двери к глубокой и подчас загадочной женской душе.

Самая пылающая из них, пожалуй — Анна Андреевна Ахматова. В строки главной солистки многоголосого хора поэзии намертво вплетены бушующие эмоции и разящая искренность. Её стихи мостят путь через лабиринты человеческой скорби и нечеловеческой любви. Вот уже сотню лет поэзия Анны Андреевны гипнотизирует и подчиняет людские сердца.

Читает Антон Тарасов — художественный руководитель театра «Неолира».",other,,"Выставка Ахматова. Большой вечер поэзии в городе Санкт-Петербург, 11 июля 2026: купить билеты — Кавёр",,,,,,600,600 руб,False,0+,https://kaverafisha.ru/__og-image__/image/saint-petersburg/events/ahmatova-bolshoyy-vecher-poezii-315956/og.png,https://kaverafisha.ru/saint-petersburg/events/ahmatova-bolshoyy-vecher-poezii-315956,kaver,2026-07-11 14:03:24
,Риф,Риф,"Спектакль по роману Алексея Поляринова «Риф».

Спектакль наполнен атмосферой репетиции: все как будто бы лишь примеряют роли, читают реплики, чтобы помочь партнёру. Вот только участников этой псевдорепетиции уносит в какие-то неведомые дали собственного сознания как будто бы даже помимо их воли. Чем больше Кира узнает о Сулиме, тем тревожнее становится атмосфера вокруг: ей делается страшно, и боится она в первую очередь самой себя.

Режиссёр — Борис Павлович.

В ролях: Юлия Гришаева, Юлия Захаркина, Анна-Магда Обершт, Кристина Токарева, Александр Худяков, Георгий Саварский, Алексей Матвейчук.",other,,"Спектакль Риф в городе Санкт-Петербург, 17 августа 2026: купить билеты — Кавёр",,,,,,2000,2000 руб,False,0+,https://kaverafisha.ru/__og-image__/image/saint-petersburg/events/rif-308510/og.png,https://kaverafisha.ru/saint-petersburg/events/rif-308510,kaver,2026-07-11 14:03:26
,Epic Con,Epic Con,"Масштабный фестиваль фантастики, кино, сериалов и компьютерных игр. Полное погружение в фантастический мир. 

Шоу программа на главной сцене проходит все два дня фестиваля. Выступления лучших косплееров России, шоу и танцевальные коллективы, постановочные номера, перфомансы. Одновременно с шоу программой на главной сцене каждый интерактивный стенд фантастических Вселенных готовит свои развлечения, квесты и розыгрыши призов. 

Больше информации об участниках и активностях:https://vk.com/epicconhttps://epiccon.ru/Ожидается подорожание билетов.",other,,"Epic Con в городе Санкт-Петербург, c 11 июля 2026 по 12 июля 2026: купить билеты — Кавёр",,,,,,2000,2000 руб,False,0+,https://kaverafisha.ru/__og-image__/image/saint-petersburg/events/epic-con-289416/og.png,https://kaverafisha.ru/saint-petersburg/events/epic-con-289416,kaver,2026-07-11 14:03:28
,Индивидуальный мастер-класс «Картина вином»,Индивидуальный мастер-класс «Картина вином»,"Напишешь картину красным вином на выбор из 40 сюжетов.

Навыки рисования не нужны, с тобой рядом будет художник-педагог, который будет помогать и поддерживать на каждом этапе с нуля до готовой картины.

Угощают каждого гостя бокалом вина или чаем.

Мастер-класс проходит в индивидуальном формате для тебя или твоей компании.",education,,"Индивидуальный мастер-класс «Картина вином» в городе Санкт-Петербург, до 12 июля 2026: купить билеты — Кавёр",,,,,,5000,5000 руб,False,0+,https://kaverafisha.ru/__og-image__/image/saint-petersburg/events/individualnyy-master-klass-kartina-vinom-312044/og.png,https://kaverafisha.ru/saint-petersburg/events/individualnyy-master-klass-kartina-vinom-312044,kaver,2026-07-11 14:03:30
,Корпорация счастья,Корпорация счастья,"В Центре современного искусства имени Сергея Курёхина пройдёт выставка выпускников магистратуры «Искусство и наука» (ИТМО). Экспозиция подведёт итоги двухлетней программы и представит лучшие проекты 24 молодых художников выпуска 2024/2026.

Выставка обыгрывает образ корпорации не как бюрократической структуры, а как художественной метафоры новых форм объединения людей и технологий. Название отсылает к книге Андрея Хааса «Корпорация счастья», где корпорация — это сеть людей, мест и инициатив. Куратор подчёркивает: акцент сделан на внутренних связях, обмене знаниями и пересечении личного с коллективным.

Работы художников становятся «отделами» воображаемой корпорации, каждый из которых исследует влияние технологий на отношения, идентичность и опыт. Например, в инсталляции Настасьи Романовой близость с ИИ оборачивается манипуляцией, Анна Вихрова в «Бэбиситтере» говорит о травме от избытка медиа в детстве, а Александр Шорохов превращает никнейм в белковую структуру, показывая гибридизацию ",other,,"Выставка Корпорация счастья в городе Санкт-Петербург, до 28 июля 2026: купить билеты — Кавёр",,,,,,300,300 руб,False,0+,https://kaverafisha.ru/__og-image__/image/saint-petersburg/events/korporatsiya-schastya-316576/og.png,https://kaverafisha.ru/saint-petersburg/events/korporatsiya-schastya-316576,kaver,2026-07-11 14:03:32
