external_id,title,short_title,description,category,tags,start_datetime,end_datetime,venue_title,venue_address,venue_lat,venue_lon,price_min,price_raw,is_free,age_restriction,image_url,site_url,source,parsed_at
,Зеркальная выставка,Зеркальная выставка,"Именитые и молодые авторы, чьи произведения находятся в музейных или известных частных коллекциях, которые регулярно экспонируются на самых крупных мировых выставках современного искусства, покажут работы, созданные на зеркалах или с их использованием, в ночном Кабаре.

«Зеркальная выставка» — это не только впечатляющий спецэффект, но и размышление о литературных образах: о резкой, как осколки, поэзии Маяковского, отражении времени и человеческих характеров в рассказах Довлатова, о рефлексии и памяти как в «Зеркале» Тарковского. 

Вход свободный.

Время работы: 
ср – чт 18:00–23:00
пт – сб 18:00–03:33",exhibition,,"Зеркальная выставка в городе Санкт-Петербург, 8 апреля 2026: купить билеты — Кавёр",,,,,,0,Бесплатно,True,0+,https://kaverafisha.ru/__og-image__/image/saint-petersburg/events/zerkalnaya-vystavka-313663/og.png,https://kaverafisha.ru/saint-petersburg/events/zerkalnaya-vystavka-313663,kaver,2026-07-11 14:04:45
,Скрижали адаптивности,Скрижали адаптивности,"Как жить в мире, где всё постоянно меняется и при этом не развалиться внутри самому? «Скрижали адаптивности» — это не лекция и не тренинг в привычном смысле. Скорее почва для совместно выращивания собственных смыслов.

Через метафоры будешь исследовать то, как двигаться вперёд, когда нет ясности и привычных ориентиров.

Что тебя ждёт:
Работа в тройках и группой — до 15 человек
3 часа погружения в текст, образы и ассоциации
Совместное исследование своего опыта и опыта других участников.

Здесь не будет правильных ответов — здесь они становятся не нужны. То, что уносишь, не пересказывается.
Скрижаль остаётся внутри и потом всплывает там, где не ждёшь.

Ведущие: Эд — врач, методолог мышления, за его постами следят 200 тыс человек.
Елена Морозова — методолог, который практикует, и практик, который концептуализирует.",other,,"Скрижали адаптивности в городе Санкт-Петербург, 20 июля 2026: купить билеты — Кавёр",,,,,,1500,1500 руб,False,0+,https://kaverafisha.ru/__og-image__/image/saint-petersburg/events/skrizhali-adaptivnosti-317201/og.png,https://kaverafisha.ru/saint-petersburg/events/skrizhali-adaptivnosti-317201,kaver,2026-07-11 14:04:47
,Ломанные ритмы х Хобо и друзья,Ломанные ритмы х Хобо и друзья,"Два танцпола, одна ночь.

Терраса: «Ломаные ритмы»
Уникальный драм-н-бейс коктейль от нежного ликвид-фанка до бодрейшего джамп-апа и взрывного нейро-фанка — самые актуальные представители сцены в одну ночь:

Gntlman | Aim | Softskilla b2b Bass Buddy | Lira | Capital Dogz b2b Chillhomers | Lena Rush b2b Bullaway | Hell G b2b Loken | Sofari b2b Xenon Ray | Ladybeat

Андер: «Хобо и друзья»
Техно, брейкбит, хардкор, драм-н-бейс и электро в едином потоке — музыкальное комьюнити, которое превращает танцпол в место силы и объединяет сердца через ритм.

Vendor | Rdm | Hobo | Lhzvr | Bolvanni | Dvd",party,,"Ломанные ритмы х Хобо и друзья в городе Санкт-Петербург, 11 июля 2026: купить билеты — Кавёр",,,,,,0,Бесплатно,True,0+,https://kaverafisha.ru/__og-image__/image/saint-petersburg/events/vecherinka-hobo-i-druzya-hobo-and-friends-311868/og.png,https://kaverafisha.ru/saint-petersburg/events/vecherinka-hobo-i-druzya-hobo-and-friends-311868,kaver,2026-07-11 14:04:50
,Леонид Кулаков | 21:30,Леонид Кулаков | 21:30,"Стендап комик, продюсер, основатель лейбла и бара «Стендап Патрики». Честный, трушный юмор на актуальные события, мимо которых пройти невозможно.

Лёню смотрят, обсуждают, критикуют и восхищаются. Его сольники уже дали много шуму и немало просмотров. Но только вживую можно по-настоящему понять — кто такой Леонид Кулаков?",other,,"Леонид Кулаков | 21:30 в городе Санкт-Петербург, 15 июля 2026: купить билеты — Кавёр",,,,,,2000,2000 руб,False,0+,https://kaverafisha.ru/__og-image__/image/saint-petersburg/events/leonid-kulakov-2130-316557/og.png,https://kaverafisha.ru/saint-petersburg/events/leonid-kulakov-2130-316557,kaver,2026-07-11 14:04:52
,Псоглавцы,Псоглавцы,"Мистический «триллер о современной русской деревне» по одноименному роману Алексея Иванова.

Трое молодых людей из Москвы — Валерий, Гугер и Кирилл — отправляются в нижегородскую деревню Калитино, чтобы выполнить высокооплачиваемый, но не до конца понятный заказ искусствоведа: снять со стены разрушенной церкви фреску с изображением святого Христофора с собачьей головой, а заодно — пронаблюдать и описать реакцию на это местных жителей.

Продолжительность спектакля 110 минут, спектакль идёт без антракта.

7 и 8 июля с 19:00 до 22:00",other,,"Спектакль Псоглавцы в городе Санкт-Петербург, c 7 июля 2026 по 8 июля 2026: купить билеты — Кавёр",,,,,,1800,1800 руб,False,0+,https://kaverafisha.ru/__og-image__/image/saint-petersburg/events/psoglavtsy-314399/og.png,https://kaverafisha.ru/saint-petersburg/events/psoglavtsy-314399,kaver,2026-07-11 14:04:54
,Арт-свидание «Картина за 3 часа при свечах»,Арт-свидание «Картина за 3 часа при свечах»,"Занятие только для вас двоих, с вами будет художник, который будет помогать написать картину.

Можно нарисовать 1 картину на холсте 40х50см вдвоём или 2 картины 30х40см.
Это могут быть разные картины или диптих (картина, состоящая из 2-х холстов).

В стоимость входят: 3 часа занятия и материалы для рисования, включая сам холст, по бокалу вина/чашечке чая и лёгкие закуски — сезонные фрукты, украшение стола свечами.",other,,"Арт-свидание «Картина за 3 часа при свечах» в городе Санкт-Петербург, до 14 сентября 2026: купить билеты — Кавёр",,,,,,8500,8500 руб,False,0+,https://kaverafisha.ru/__og-image__/image/saint-petersburg/events/art-svidanie-kartina-za-3-chasa-pri-svechah-312040/og.png,https://kaverafisha.ru/saint-petersburg/events/art-svidanie-kartina-za-3-chasa-pri-svechah-312040,kaver,2026-07-11 14:04:56
,Аватар,Аватар,"На самом большом проекционном куполе в мире воссоздадут атмосферу легендарного фильма «Аватар»: пейзажи Пандоры, просторы космоса, удивительный растительный и животный мир, а главное, конечно же, музыка Джеймса Хорнера в исполнении ведущих музыкантов «Амадеус».

Зрителей ждёт часовое музыкально-проекционное шоу, в котором ты сможешь почувствовать себя настоящими космическими путешественниками.

Уникальные аранжировки к легендарным музыкальным композициям, эффектные световые решения составят единое аудиовизуальное целое с полнокупольной графикой, подготовленной специально для шоу студией Планетария 1.

Всё это позволит представить зрителю не «реплику» фильма, а отдельное его прочтение, с сохранением его оригинальной атмосферы, но позволяющее иначе воспринять именно музыку к фильму.

Всё шоу сопровождается визуальным контентом, который буквально захватывает дух и превращает слушание в музыки в настоящую космическую медитацию.

Музыкальный состав: струнный ансамбль «Амадеус», орган, клави",other,,"Аватар в городе Санкт-Петербург, 24 июля 2026: купить билеты — Кавёр",,,,,,3000,3000 руб,False,0+,https://kaverafisha.ru/__og-image__/image/saint-petersburg/events/avatar-312763/og.png,https://kaverafisha.ru/saint-petersburg/events/avatar-312763,kaver,2026-07-11 14:04:59
,Время жить,Время жить,"Человек может годами строить жизнь, которая подходит всем — кроме тебя самого.

Большинство людей живут с иллюзией, что время ещё есть.

Кажется, что настоящая жизнь начнётся когда-нибудь «потом»: когда появится уверенность, вырастут дети, появятся деньги или изменятся обстоятельства.

Но реальность в том, что никакого «потом» не существует.

Выставка может помочь:
/ Понять свои истинные желания и  куда исчезает внутренний ресурс, как вернуть мотивацию к жизни.
/ Разрушить иллюзию отложенной жизни.
/ Найти свой Икигай: Вернуть ощущение внутреннего согласия, когда то, что ты делаешь, полностью совпадает с тем, кто ты есть.

Вход на выставку только по предварительной записи. 
Время работы: ежедневно с 12:00 до 21:00",other,,"Выставка Время жить в городе Санкт-Петербург, до 20 июля 2026: купить билеты — Кавёр",,,,,,1000,1000 руб,False,0+,https://kaverafisha.ru/__og-image__/image/saint-petersburg/events/vremya-zhit-306495/og.png,https://kaverafisha.ru/saint-petersburg/events/vremya-zhit-306495,kaver,2026-07-11 14:05:01
,Музыка в оранжерее,Музыка в оранжерее,"Музыкальный концерт-ретрит в тропической обстановке.

На концерте два совершенно разных и противоположных настроения: одно — трепетное, нежное и романтичное, другое — дерзкое и сочное сольются в буйстве звуков и эмоций в исполнении ведущих артистов Петербурга в царстве лета, ярких цветов и величественных деревьев.

Продолжительность концерта: 1 час 20-40 минут",concert,,"Музыка в оранжерее в городе Санкт-Петербург, до 29 августа 2026: купить билеты — Кавёр",,,,,,1500,1500 руб,False,0+,https://kaverafisha.ru/__og-image__/image/saint-petersburg/events/muzyka-v-oranzheree-251917/og.png,https://kaverafisha.ru/saint-petersburg/events/muzyka-v-oranzheree-251917#comment-49964,kaver,2026-07-11 14:05:03
,Идиот,Идиот,"Моноспектакль.

Роман Достоевского «Идиот» — как и вся подлинная классика — существует вне времени и рассказывает нам о нас же самих — сегодняшних зрителях, сидящих в зале.

Одна из центральных тем постановки — любовь во всех её проявлениях. Любовь как испытание. Любовь как приговор. Любовь как последняя надежда и спасение.

Моноспектакль «Идиот» не даёт готовых ответов — он задаёт вопросы, от которых невозможно уклониться.",other,,"Спектакль Идиот в городе Санкт-Петербург, 25 июля 2026: купить билеты — Кавёр",,,,,,2500,2500 руб,False,0+,https://kaverafisha.ru/__og-image__/image/saint-petersburg/events/idiot-315418/og.png,https://kaverafisha.ru/saint-petersburg/events/idiot-315418,kaver,2026-07-11 14:05:06
,В свечах: Джаз в особняке Половцова,В свечах: Джаз в особняке Половцова,"Цикл событий #В_СВЕЧАХ от команды Русские Музыкальные Сезоны превращает самые красивые и необычные залы Петербурга в уютные джаз-клубы, наполняя пространство залов тёплым светом тысячи свечей, что создаёт неповторимую атмосферу и идеальный фон для джазовых мелодий.

Приготовься устроиться поудобнее и насладиться шедеврами мира джаза в виртуозном исполнении талантливого бэнда.

Экскурсия-проход по парадным залам оплачивается дополнительно к билету по желанию.

Начало экскурсии за час до начала концерта.",other,,"В свечах: Джаз в особняке Половцова в городе Санкт-Петербург, 12 июля 2026: купить билеты — Кавёр",,,,,,1500,1500 руб,False,0+,https://kaverafisha.ru/__og-image__/image/saint-petersburg/events/vsvechah-jaz-v-osobnyake-polovtsova-262884/og.png,https://kaverafisha.ru/saint-petersburg/events/vsvechah-jaz-v-osobnyake-polovtsova-262884,kaver,2026-07-11 14:05:08
,Вписка чип-бар,Вписка чип-бар,"Вход 300р., напитки от 250р., специальное меню с антикризисными ценами и кайфовая летняя терраса.

Тебя ждут:
— напитки от 250р.
— уличный баскетбол
— стрит-арт активности
— гигантская дженга
— бир-понг
— стрит-фуд и снеки

18+ | FC/DC | Ориг. Документов",other,,"Вписка чип-бар в городе Санкт-Петербург, 18 июля 2026: купить билеты — Кавёр",,,,,,300,300 руб,False,0+,https://kaverafisha.ru/__og-image__/image/saint-petersburg/events/vpiska-chip-bar-317091/og.png,https://kaverafisha.ru/saint-petersburg/events/vpiska-chip-bar-317091,kaver,2026-07-11 14:05:10
,Одни тут?,Одни тут?,"Лапшичный кутёж во дворике на Невском.

Будешь есть лапшу на выездной станции, пить безалкогольные спешл-коктейли, а также слушать диджей-сеты. 

Kust
4IZA
Splitsweet

Вход свободный.",other,,"Одни тут? в городе Санкт-Петербург, 11 июля 2026: купить билеты — Кавёр",,,,,,0,Бесплатно,True,0+,https://kaverafisha.ru/__og-image__/image/saint-petersburg/events/odni-tut-317084/og.png,https://kaverafisha.ru/saint-petersburg/events/odni-tut-317084,kaver,2026-07-11 14:05:12
,Шутки и фокусы,Шутки и фокусы,"Сборный концерт, где собрали лучших комиков и фокусников Москвы и Санкт-Петербурга.

Ведущий: Глеб Капелюх

Приходи, если готов одновременно смеяться и задаваться вопросом «как он это сделал?»",other,,"Шутки и фокусы в городе Санкт-Петербург, 11 июля 2026: купить билеты — Кавёр",,,,,,700,700 руб,False,0+,https://kaverafisha.ru/__og-image__/image/saint-petersburg/events/shutki-i-fokusy-312329/og.png,https://kaverafisha.ru/saint-petersburg/events/shutki-i-fokusy-312329,kaver,2026-07-11 14:05:15
,Стендап проверка на троих,Стендап проверка на троих,"Три опытных комика проверят свои шутки.

Состав: Арсений Алексеев, Ваня Колесников, Лёша Полубояров.",other,,"Стендап проверка на троих в городе Санкт-Петербург, 13 июля 2026: купить билеты — Кавёр",,,,,,300,300 руб,False,0+,https://kaverafisha.ru/__og-image__/image/saint-petersburg/events/stendap-proverka-na-troih-316315/og.png,https://kaverafisha.ru/saint-petersburg/events/stendap-proverka-na-troih-316315,kaver,2026-07-11 14:05:17
,ЭлектроСимфония,ЭлектроСимфония,"ЭлектроСимфония — авторская программа Ильи Щеклеина, в которой виртуозное фортепиано сочетается с электронными инструментами и современными технологиями звучания.

Музыкант создаёт атмосферный кинематографичный саунд на стыке джаза, классики, эмбиента и электроники. В программе авторские композиции, импровизации и оригинальные аранжировки известных мелодий.

В пространстве планетария музыка обретает особое измерение: звук соединяется с масштабными визуальными проекциями купола, превращая концерт в захватывающее аудиовизуальное путешествие.",other,,"ЭлектроСимфония в городе Санкт-Петербург, 15 июля 2026: купить билеты — Кавёр",,,,,,1200,1200 руб,False,0+,https://kaverafisha.ru/__og-image__/image/saint-petersburg/events/elektrosimfoniya-316311/og.png,https://kaverafisha.ru/saint-petersburg/events/elektrosimfoniya-316311,kaver,2026-07-11 14:05:19
,Одиссея (Odyssey) 2026,Одиссея (Odyssey) 2026,"Тебя ждёт фестиваль, полный воодушевления, преисполненности и бесконечного счастья без предела. 

Всё секретно, таинственно, на уровне загадочного пророчества о главном грядущем приключении лета 2026. Подробности скоро....",festival,,"Одиссея (Odyssey) 2026 в городе Санкт-Петербург, 18 июля 2026: купить билеты — Кавёр",,,,,,5500,5500 руб,False,0+,https://kaverafisha.ru/__og-image__/image/saint-petersburg/events/odyssey-festival-297864/og.png,https://kaverafisha.ru/saint-petersburg/events/odyssey-festival-297864,kaver,2026-07-11 14:05:22
,КняZz. Фокусник,КняZz. Фокусник,"Вечер для тех, кто до сих пор знает, как выглядит настоящий русский рок, и не боится немного театральной мрачности.

КняZz привезут программу «Фокусник» — с готическими историями, тяжёлыми гитарами и атмосферой, где кажется, что сейчас либо начнётся концерт, либо откроется портал в тёмное фэнтези.

В программе — любимые хиты, громкий живой звук и песни, под которые зал дружно превращается в хор людей в чёрном. Будет много мистики, драматичных припевов и того самого вайба, когда хочется серьёзно кивать головой под гитарный рифф и смотреть вдаль с очень задумчивым лицом.

Подойдёт тем, кто любит рок с историей, немного мрачную эстетику и концерты, после которых хочется переслушать всё детство заново.",other,,"КняZz. Фокусник в городе Санкт-Петербург, 19 июля 2026: купить билеты — Кавёр",,,,,,2500,2500 руб,False,0+,https://kaverafisha.ru/__og-image__/image/saint-petersburg/events/knyazz-fokusnik-315459/og.png,https://kaverafisha.ru/saint-petersburg/events/knyazz-fokusnik-315459,kaver,2026-07-11 14:05:26
,Phagamast Showcase,Phagamast Showcase,"В эту ночь подготовили специальное live-выступление Vladis — электронного артиста, певца и продюсера, создающего мелодичную музыку с эмоциональным вокалом. Его саунд балансирует между хаус, техно и альтернативной электроникой, а каждая композиция звучит как небольшой фильм, где эмоции говорят громче слов.

Лайнап:
Nikita Grib • Netochno • MaxDee • SKLV • Lobanov",other,,"Phagamast Showcase в городе Санкт-Петербург, 25 июля 2026: купить билеты — Кавёр",,,,,,1500,1500 руб,False,0+,https://kaverafisha.ru/__og-image__/image/saint-petersburg/events/phagamast-showcase-317183/og.png,https://kaverafisha.ru/saint-petersburg/events/phagamast-showcase-317183,kaver,2026-07-11 14:05:28
