external_id,title,short_title,description,category,tags,benefits,start_datetime,end_datetime,venue_title,venue_address,venue_lat,venue_lon,price_min,price_raw,is_free,age_restriction,image_url,site_url,source,parsed_at
,Юля Чеснокова,Юля Чеснокова,"Сольный стендап-концерт Юли Чесноковой.

Юлия Чеснокова — стендап-комик с абсурдистским юмором, необычными историями из жизни и провокационными шутками.",stand-up,,,14 июля 2026,,Stage StandUp Club,ул. Восстания 24/27Б Начало: 14 июля 2026 в 20:00 Завершение: 1,,,500,от 500 ₽,False,18+,,https://kaverafisha.ru/saint-petersburg/events/zhenskiyy-stendap-vecher-yulya-chesnokova-273234,kaver,2026-07-14 14:52:20
,Стендап по-женски,Стендап по-женски,"Лучшие девушки комики Петербурга, а также специальные гостьи с разных уголков России соберутся, чтобы дать зрителю свой отборный юмор, как следует отпесочить мужичков, а также выговориться на наболевшие темы без цензуры.

Это шоу понравится и мужчинам, и девушкам, ведь женский стендап более искренний и эмоциональный. И каждые выходные тебя ждёт приглашённый комик из Москвы с телепроектов ТНТ, который станет хедлайнером вечера.

Запуск гостей за час до концерта, но ты всегда можешь прийти пораньше и отдохнуть в другом зале в режиме ресторана.

Во время концерта работает бар и кухня. 

Бронь столика держится за тобой только до конца концерта.

Дресскод на время стендапа не действует, но если ты хочешь продолжить отдых в заведении после стендапа, тогда тебе нужно соблюдать его дресскод.

Мероприятия строго 18+.

Расписание по кнопке «Купить билет»",stand-up,,,31 июля 2026,,Сплетни бар by Anna Asti,,,,590,от 590 ₽,False,18+,,https://kaverafisha.ru/saint-petersburg/events/zhenskiyy-stendap-v-bare-spletni-255937,kaver,2026-07-14 14:52:22
,Элитный Стендап,Элитный Стендап,"Перед тобой выступят комики с ТНТ, НТВ, ЖКХ, ВДВ...
Регалий предостаточно, кто-то сын маминой подруги, а у кого-то грамота за турнир по рыбалке.

Расписание доступно по кнопке  «Купить билет».",stand-up,,,7 августа 2026,,,"улица Рубинштейна, 9/",,,600,от 600 ₽,False,18+,,https://kaverafisha.ru/saint-petersburg/events/elitnyy-stand-up-261391,kaver,2026-07-14 14:52:25
,Элитный стендап,Элитный стендап,"Твоё идеальное свидание с комедией.

Перед тобой выступят комики с ТНТ, НТВ, ЖКХ, ВДВ. Регалий предостаточно, кто-то сын маминой подруги, а у кого-то грамота за турнир по рыбалке.

Каждую сб и вс",stand-up,,,30 августа 2026,,,,,,400,от 400 ₽,False,18+,,https://kaverafisha.ru/saint-petersburg/events/elitnyy-stendap-313746,kaver,2026-07-14 14:52:30
,Леонид Кулаков | 19:00,Леонид Кулаков | 19:00,"Стендап комик, продюсер, основатель лейбла и бара «Стендап Патрики». Честный, трушный юмор на актуальные события, мимо которых пройти невозможно.

Лёню смотрят, обсуждают, критикуют и восхищаются. Его сольники уже дали много шуму и немало просмотров. Но только вживую можно по-настоящему понять — кто такой Леонид Кулаков?",stand-up,,,15 июля 2026,,Stage StandUp Club,ул. Восстания 24/27Б Начало: 15 июля 2026 в 19:00 Завершение: 1,,,2000,от 2000 ₽,False,18+,,https://kaverafisha.ru/saint-petersburg/events/leonid-kulakov-1900-316554,kaver,2026-07-14 14:52:34
,Леонид Кулаков | 21:30,Леонид Кулаков | 21:30,"Стендап комик, продюсер, основатель лейбла и бара «Стендап Патрики». Честный, трушный юмор на актуальные события, мимо которых пройти невозможно.

Лёню смотрят, обсуждают, критикуют и восхищаются. Его сольники уже дали много шуму и немало просмотров. Но только вживую можно по-настоящему понять — кто такой Леонид Кулаков?",stand-up,,,15 июля 2026,,Stage StandUp Club,ул. Восстания 24/27Б Начало: 15 июля 2026 в 19:00 Завершение: 1,,,2000,от 2000 ₽,False,18+,,https://kaverafisha.ru/saint-petersburg/events/leonid-kulakov-2130-316557,kaver,2026-07-14 14:52:36
,Антон Борисов,Антон Борисов,"Опытнейший стендап-комик из Санкт-Петербурга, которого называют одним из основателей жанра в России.

Неповторимый микс умной взрослой комедии, интересных мыслей и отличной импровизации, которая является неотъемлемой частью любого выступления Антона Борисова.

Рассадка осуществляется менеджером зала.",stand-up,,,16 июля 2026,,Stage StandUp Club,ул. Восстания 24/27Б Начало: 16 июля 2026 в 19:00 Завершение: 1,,,1000,от 1000 ₽,False,18+,,https://kaverafisha.ru/saint-petersburg/events/anton-borisov-311734,kaver,2026-07-14 14:52:38
,Восемь комиков,Восемь комиков,"Классический стендап вечер, на котором опытные питерские комики проверят свои шутки, а ты сможешь познакомиться с новыми для себя представителями комедийной сцены.

Рассадка осуществляется менеджером зала.
Приходи к началу запуска, чтобы занять места ближе к сцене.",stand-up,,,16 июля 2026,,Stage StandUp Club,ул. Восстания 24/27Б Начало: 16 июля 2026 в 20:00 Завершение: 1,,,500,от 500 ₽,False,18+,,https://kaverafisha.ru/saint-petersburg/events/vosem-komikov-250413,kaver,2026-07-14 14:52:41
,Книжный стендап,Книжный стендап,"Шоу, где комики шутят о прочитанных книгах. 

Тебя зовут похихикать над книжками, послушать рецензии от комиков и узнать, что же всё-таки имел в виду автор.

Атмосферный бар, приятная компания и несколько книжек, которые совершенно необязательно читать, чтобы над ними посмеяться.",stand-up,,,16 июля 2026,,Popravka,пр. 50,,,500,от 500 ₽,False,18+,,https://kaverafisha.ru/saint-petersburg/events/knizhnyy-stendap-311444,kaver,2026-07-14 14:52:43
,Тимур Каргинов. Проверочный концерт,Тимур Каргинов. Проверочный концерт,"Стендап-комик, креативный продюсер, ведущий KuJi Podcast.

В концерте Тимур делает акцент не на количестве шуток, а на глубине каждой своей мысли и говорит только о том, что живо интересует его самого. Как и прежде, Каргинов создаёт самобытную комедию с интеллектуальным подтекстом, где содержание важнее формы.",stand-up,,,16 июля 2026,,Stage StandUp Club,ул. Восстания 24/27Б Начало: 16 июля 2026 в 21:30 Завершение: 1,,,2500,от 2500 ₽,False,18+,,https://kaverafisha.ru/saint-petersburg/events/timur-karginov-proverochnyy-kontsert-314220,kaver,2026-07-14 14:52:45
,Гассан Джабер,Гассан Джабер,"Гассан Джабер — стендап-комик, финалист шоу «Comedy Баттл» на телеканале ТНТ.

Приходи поднять себе настроение, смешными шутками которые точно попадут в тебя, чтобы зарядиться энергией комедии, перед очередной рабочей неделей",stand-up,,,17 июля 2026,,Stage StandUp Club,ул. Восстания 24/27Б Начало: 17 июля 2026 в 19:00 Завершение: 1,,,1000,от 1000 ₽,False,16+,,https://kaverafisha.ru/saint-petersburg/events/stendap-kontsert-305662,kaver,2026-07-14 14:52:48
,Стендап вечер,Стендап вечер,"Формат, где опытные комики рассказывают самые свежие и самые проверенные шутки.

Запуск на мероприятие за полчаса до начала.
Рассадка осуществляется менеджером зала в порядке очереди.
Приходи к началу запуска, чтобы занять места ближе к сцене.",stand-up,,,17 июля 2026,,Homie,,,,500,от 500 ₽,False,18+,,https://kaverafisha.ru/saint-petersburg/events/stendap-vecher-285176,kaver,2026-07-14 14:52:50
,Взрослый стендап,Взрослый стендап,"Стендап с высоты некоторого прожитого опыта, допущенных ошибок, а также их осознания. 

В России возраст молодёжи официально до 35 лет, а значит комики, выступающие на этом шоу уже на этапе взросления или же официально взрослые люди.",stand-up,,,17 июля 2026,,Stage StandUp Club,ул. Восстания 24/27Б Начало: 17 июля 2026 в 20:00 Завершение: 1,,,500,от 500 ₽,False,18+,,https://kaverafisha.ru/saint-petersburg/events/vzroslye-komiki-248361,kaver,2026-07-14 14:52:52
,Грязный стендап,Грязный стендап,"Мероприятие с рейтингом «18+» — четыре комика, ведущий и ни одной запретной темы. Готов услышать самые грязные шутки? Тогда тебе точно сюда!",stand-up,,,17 июля 2026,,Stage StandUp Club,ул. Восстания 24/27Б Начало: 17 июля 2026 в 23:00 Завершение: 1,,,900,от 900 ₽,False,18+,,https://kaverafisha.ru/saint-petersburg/events/gryaznyy-stendap-261897,kaver,2026-07-14 14:52:56
,ЛяМур с Нидалем | 16:00,ЛяМур с Нидалем | 16:00,"ЛяМур — это шоу знакомств Нидаля Абу Газале. Участники влюбляются по голосу и харизме, а в конце — встречаются лицом к лицу. Что их ждёт: любовь или разочарование? Весёлый вечер — гарантирован.

Рассадка осуществляется менеджером зала. Приходи к началу запуска, чтобы занять места ближе к сцене.",stand-up,,,18 июля 2026,,Stage StandUp Club,ул. Восстания 24/27Б Начало: 18 июля 2026 в 16:00 Завершение: 1,,,600,от 600 ₽,False,18+,,https://kaverafisha.ru/saint-petersburg/events/lyamur-s-nidalem-291603,kaver,2026-07-14 14:52:59
,Выставка Булгаков. Мастер и Маргарита,Выставка Булгаков. Мастер и Маргарита,"Литературная встреча-разговор по мотивам произведений М.А.Булгакова.

Бессмертное, загадочное и остроумное «Евангелие от Сатаны» Михаила Булгакова.
Роман, уникальный в российской литературе ХХ столетия. Трудно себе представить, какое влияние он оказал на мировую культуру.

Чем же заворожила история о дьяволе и его свите, почтивших своим присутствием Москву 1930-х, о прокураторе Иудеи всаднике Понтии Пилате и нищем философе Иешуа Га-Ноцри, о талантливом и несчастном Мастере и его прекрасной и верной возлюбленной Маргарите?

Читает Антон Тарасов.",stand-up,,,14 июля 2026,,,ул. Некрасова,,,600,от 600 ₽,False,18+,,https://kaverafisha.ru/saint-petersburg/events/bulgakov-master-i-margarita-315957,kaver,2026-07-14 14:53:01
,Кинопоказ в саду: «8 1/2»,Кинопоказ в саду: «8 1/2»,"В этот вечер смотрят стильную драматическую комедию Федерико Феллини «8 1/2».

Вечер пройдёт под открытым небом в камерном саду Особняка Мясникова, в самом сердце Петербурга. Для удобного просмотра расставят мягкие стулья-шезлонги и предложим тебе попкорн. Вход в сад — со стороны Гродненского переулка.",stand-up,,,14 июля 2026,,Особняк И. Мясникова,"ул. Восстания, 45",,,2200,от 2200 ₽,False,12+,,https://kaverafisha.ru/saint-petersburg/events/kinopokaz-v-sadu-8-12-316673,kaver,2026-07-14 14:53:03
,Инь & Хатха-йога с Юлией Лычак,Инь & Хатха-йога с Юлией Лычак,"Специальный класс от преподавателя из московский студий Yoga Space, на котором медитативная глубина Инь-йоги встречается с динамикой Хатха-йоги.

Практика начнётся мягко: через длительные асаны, расслабление и внимательное наблюдение за собой. Постепенно ты перейдёшь к более активным связкам, которые помогут пробудить тело, наполниться силой и энергией.

В результате ты ощутишь состояние целостности и внутреннего баланса, наполненное спокойствием, лёгкостью и тихой радостью.

Завершится практика глубокой шавасаной под звучание поющих чаш.

Класс ведёт Юлия Лычак — сертифицированный преподаватель инь-йоги и хатха-йоги.",stand-up,,,14 июля 2026,,,"проспект Чернышевского, 18",,,1400,от 1400 ₽,False,16+,,https://kaverafisha.ru/saint-petersburg/events/in-hatha-yyoga-s-yulieyy-lychak-316519,kaver,2026-07-14 14:53:06
,Спектакль Не кормите и не трогайте,Спектакль Не кормите и не трогайте,"Спектакль с атмосферой Лондона и драйвом Питера.

Андрей — тихий петербургский интеллигент, едет в Лондон к роскошной Кате, желая оказаться в романтической комедии, а попадает в русский детектив. Есть ли разница между британским пабом и питерской рюмочной? Быть ли на виду или скрыться в подвале?

Острый актуальный текст. Лаконичная театральная форма. 

Автор романа — Андрей Аствацатуров — культовый петербургский писатель и профессор Петербургского университета, лауреат премий «Топ 50» и «Новая словесность», его романы с успехом продаются в России, Франции, Великобритании.",stand-up,,,22 июля 2026,,Bar 3/4,ул. Чайковского 34 Начало: 14 июля 2026 в 20:00 Завершение: 22,,,2200,от 2200 ₽,False,18+,,https://kaverafisha.ru/saint-petersburg/events/ne-kormite-i-ne-trogayyte-242571,kaver,2026-07-14 14:53:08
,Спектакль Москва-Петушки,Спектакль Москва-Петушки,"Квартирник-притча о двух Венях.

Проснувшись утром в чьем-то неведомом подъезде, Веня Ерофеев устремляется на Курский вокзал, чтобы оттуда отправиться в свое экзистенциальное постмодернистское путешествие в Петушки — рай на земле, столь же желанный, сколь и недостижимый. В этом путешествии его сопровождают Ангелы Господни, а также гитара и песни уже другого Вени — Д'ркина, чья судьба также была наполнена светом и трагизмом.

Спектакль-притча по поэме Венедикта Ерофеева — о гибели и воскрешении; о непутёвости и поиске пути; и, конечно же, о вознесении.

Спектакль-квартирник по песням музыканта, поэта и певца Александра Литвинова, более известного, как Веня Д'ркин.

Спектакль-застолье — Тайная вечеря в вагоне советской электрички.

11, 14 и 15 июля с 20:00 до 21:50",stand-up,,,15 июля 2026,,Курт,"ул. Чайковского, 16",,,2200,от 2200 ₽,False,18+,,https://kaverafisha.ru/saint-petersburg/events/moskva-petushki-304263,kaver,2026-07-14 14:53:10
,Выставка История всего: от Сотворения до Апокалипсиса,Выставка История всего: от Сотворения до Апокалипсиса,"А что если собрать самые эффектные и запоминающиеся инсталляции арт-группы «Зерно» на одной выставке в Анненкирхе?

Так и сделали — и представляют библейскую историю от Сотворения до Апокалипсиса через попурри лучших арт-объектов с предыдущих выставок. Это именно те экспонаты, которые запали тебе в душу и поселились в сердечке.

В большой зал вернулась легендарная Луна, на лестнице распустились сады, на втором этаже колышутся волны потопа и видна радуга, в ротонде сверкает гигантский серафим, а в часовне тебя ждёт киберпастор. Каждая локация — это твой путеводитель по Библии и портал к воспоминаниям о прошлых вдохновляющих экспозициях в уникальной лютеранской кирхе.

Режим работы: с 10:00 до 18:00",stand-up,,,7 августа 2026,,Анненкирхе,,,,600,от 600 ₽,False,6+,,https://kaverafisha.ru/saint-petersburg/events/istoriya-vsego-ot-sotvoreniya-do-apokalipsisa-311062,kaver,2026-07-14 14:53:12
,Спектакль Псоглавцы,Спектакль Псоглавцы,"Мистический «триллер о современной русской деревне» по одноименному роману Алексея Иванова.

Трое молодых людей из Москвы — Валерий, Гугер и Кирилл — отправляются в нижегородскую деревню Калитино, чтобы выполнить высокооплачиваемый, но не до конца понятный заказ искусствоведа: снять со стены разрушенной церкви фреску с изображением святого Христофора с собачьей головой, а заодно — пронаблюдать и описать реакцию на это местных жителей.

Продолжительность спектакля 110 минут, спектакль идёт без антракта.

7 и 8 июля с 19:00 до 22:00",stand-up,,,7 июля 2026,,Курт,"ул. Чайковского, 16",,,2200,от 2200 ₽,False,18+,,https://kaverafisha.ru/saint-petersburg/events/psoglavtsy-314399,kaver,2026-07-14 14:53:17
,Музыка в оранжерее,Музыка в оранжерее,"Музыкальный концерт-ретрит в тропической обстановке.

На концерте два совершенно разных и противоположных настроения: одно — трепетное, нежное и романтичное, другое — дерзкое и сочное сольются в буйстве звуков и эмоций в исполнении ведущих артистов Петербурга в царстве лета, ярких цветов и величественных деревьев.

Продолжительность концерта: 1 час 20-40 минут",stand-up,,,29 августа 2026,,Оранжерея таврического сада,,,,1500,от 1500 ₽,False,6+,,https://kaverafisha.ru/saint-petersburg/events/muzyka-v-oranzheree-251917,kaver,2026-07-14 14:53:21
,Выставка Время жить,Выставка Время жить,"Человек может годами строить жизнь, которая подходит всем — кроме тебя самого.

Большинство людей живут с иллюзией, что время ещё есть.

Кажется, что настоящая жизнь начнётся когда-нибудь «потом»: когда появится уверенность, вырастут дети, появятся деньги или изменятся обстоятельства.

Но реальность в том, что никакого «потом» не существует.

Выставка может помочь:
/ Понять свои истинные желания и  куда исчезает внутренний ресурс, как вернуть мотивацию к жизни.
/ Разрушить иллюзию отложенной жизни.
/ Найти свой Икигай: Вернуть ощущение внутреннего согласия, когда то, что ты делаешь, полностью совпадает с тем, кто ты есть.

Вход на выставку только по предварительной записи. 
Время работы: ежедневно с 12:00 до 21:00",stand-up,,,20 июля 2026,,Путь,,,,600,от 600 ₽,False,18+,,https://kaverafisha.ru/saint-petersburg/events/vremya-zhit-306495,kaver,2026-07-14 14:53:26
