external_id,title,short_title,description,category,tags,benefits,start_datetime,end_datetime,venue_title,venue_address,venue_lat,venue_lon,price_min,price_raw,is_free,age_restriction,image_url,site_url,source,parsed_at
,Рейв на крыше с оркестром,Рейв на крыше с оркестром,"В этот вечер крыша у залива превратится в огромный танцпол под открытым небом, где объединятся два мира — энергия большого рейва и игра живого оркестра.

На одной сцене диджей и музыканты исполнят легендарные хиты электронной музыки 90-х и 2000-х в новом масштабном звучании: от The Prodigy, Pendulum, Chemical Brothers и Scooter до Daft Punk, Darude, Moby и Armin Van Buuren.

Представь: закат над городом, оркестр, ударные, электронные биты и тысячи людей, поющих и танцующих под музыку, которая изменила целое поколение.

The Prodigy, Pendulum, Daft Punk, Chemical Brothers, Scooter, Darude, Benny Benassi, Armin Van Buuren, Fatboy Slim, Moby, Global Deejays, Eric Prydz, Robert Miles и другие легенды электронной сцены прозвучат так, как вы их еще никогда не слышали.

Сбор гостей: 22:00 - 23:00 (диджей сет)
Концерт: 23:00 - 01:00 (Orchestra x DJ)",concert,,,25 июля 2026,,Roof Place,,,,1900,от 1900 ₽,False,18+,,https://kaverafisha.ru/saint-petersburg/events/reyyv-na-kryshe-s-orkestrom-316676,kaver,2026-07-14 14:54:07
,Спектакль Эстетика лета (Summercore),Спектакль Эстетика лета (Summercore),"Летний фестиваль альтернативной музыки. Тебя  ждут жёсткие риффы, мощные брейки, экспрессивный вокал и атмосфера настоящего музыкального безумия.

На сцене пять групп, которые раскачают клуб:

Syzygy71 — откроют вечер футуристичным нью?металом с электронными вкраплениями. Тяжёлые биты, индустриальные звуки и синтезаторные текстуры создадут атмосферу кибернетического апокалипсиса. Динамичное световое шоу усилит эффект.

SAYO — мощный металкор с элементами электроники и резкими контрастами: от шёпота к крику, от минималистичных партий к плотным гитарным стенам. Их выступление — это эмоциональная буря, которая захватит зал.

Descaped — модерн метал с техничными брейками, острыми риффами и экспрессивным вокалом. Жёсткий слэм, плотный звук и прямой контакт с аудиторией — их сет станет настоящим испытанием на прочность.

Gonzo Fellaz — взрывная смесь альтернативы и нью?метала с агрессивными риффами, резкими сменами темпа и харизматичным вокалом. Их энергия заставит зал двигаться без остановки.

Sleeping satellite — закроют фестиваль мощным сет?листом в стиле электроникор. Мощные брейкдауны, завораживающие электронные мелодии и эмоциональный вокал подведут итог вечера на пике адреналина.",concert,,,26 июля 2026,,Jagger,"площадь Конституции, 2",,,600,от 600 ₽,False,18+,,https://kaverafisha.ru/saint-petersburg/events/estetika-leta-summercore-316677,kaver,2026-07-14 14:54:09
,Комната культуры,Комната культуры,"«Самолёты», «Поезда», «Первая любовь» и все любимые треки прозвучат так, как и должны — в тёплый вечер, на свежем воздухе, когда небо медленно темнеет, а музыка становится громче с каждой минутой.

Это будет тот самый летний концерт, где хочется петь вместе и ловить каждую секунду.",concert,,,30 июля 2026,,,"улица Красного Текстильщика, 10",,,3800,от 3800 ₽,False,16+,,https://kaverafisha.ru/saint-petersburg/events/komnata-kultury-296468,kaver,2026-07-14 14:54:11
,Летний Бах,Летний Бах,"Здесь знаменитые сочинения немецкого гения исполняются под показ красочных цветочных медиапроекций, расцветающих на обожженных стенах церкви.

Лето, классика и музыка во всей полноте. Программу исполняют органистка Александра Веткина и ансамбль Una Volta (скрипка, альт, виолончель, флейта).

Музыка в Анненкирхе исполняется на электрооргане.",concert,,,30 июля 2026,,Анненкирхе,,,,1500,от 1500 ₽,False,12+,,https://kaverafisha.ru/saint-petersburg/events/letniyy-bah-316745,kaver,2026-07-14 14:54:13
,Спектакль Вдох,Спектакль Вдох,"Шоу — белый лист, коллективная импровизация. Зрители сами создают декорации, персонажей и сюжет. Актеры театра только держат границы, расставляют опорные точки для развития сюжета и помогают с реквизитом. Ваше воображение творит невозможное и каждый раз участники создают новый невероятный мир.

Мир не создается в одиночку. Шоу дает важный опыт творческого коллективного взаимодействия: как слушать друг друга, предлагать свои и откликаться на чужие идеи. Чистая импровизация дает мощный творческий импульс — возможно, этот мир будет ещё долго вам сниться...

В спектакле участвует от 2 до 6 человек.
Время сеансов разное, подробности по ссылке.",theater,,,30 августа 2026,,Морфеус,"набережная реки Мойки, 28",,,600,от 600 ₽,False,16+,,https://kaverafisha.ru/saint-petersburg/events/vdoh-280226,kaver,2026-07-14 14:54:15
,Спектакль Иностранка,Спектакль Иностранка,"Это спектакль о небезупречности человека, которая и делает его уникальным и столь прекрасным.

Ностальгический мюзикл по одноимённой повести Сергея Довлатова.

У Муси Татарович, девушки из хорошей советской семьи, есть всё, о чем кто-либо другой может только мечтать. Вот только счастливой она себя не чувствует и не может найти своё место в жизни.

Что же в таких случаях принято делать? Правильно: следует поддаться манящему зову американской мечты и скорее эмигрировать из Союза!

Но и в Америке достичь счастья оказывается не так просто. Верными спутниками каждого жителя русского квартала в Нью-Йорке оказываются неустроенность, тоска по дому и одиночество.

Эти герои — совсем не ""герои"": неприкаянные, смешные, недалекие, горемычные, но такие трогательные и обаятельные, что в них невозможно не влюбиться.

«Я люблю таких — отпетых, погибающих, беспомощных и нахальных. Я всегда повторял: кто бедствует, тот не грешит...»

Продолжительность 2 часа 45 мин.",theater,,,17 июля 2026,,Курт,"ул. Чайковского, 16",,,2200,от 2200 ₽,False,16+,,https://kaverafisha.ru/saint-petersburg/events/inostranka-268660,kaver,2026-07-14 14:54:18
,Спектакль Спектакль-променад «Тайны наследства братьев Мясниковых»,Спектакль Спектакль-променад «Тайны наследства братьев Мясниковых»,"Иммерсивный спектакль-променад, который пройдёт в старинном особняке. Ты станешь свидетелем истории, которая пошатнула общество России и стала одним из самых громких судебных разбирательств прошлой эпохи. Перед твоими глазами оживут последние года жизни первых владельцев особняка — братьев Мясниковых, Ивана и Александра.

Особняк Мясникова — исторический и архитектурный памятник XIX века, построенный в 1859 году в самом сердце Петербурга. Здание возвели по заказу Ивана Константиновича Мясникова, одного из двух братьев. Однако дурная слава владельцев повлияла на славу самого особняка — долгое время его именовали не иначе как «сутяжный особняк».

Дело в том, что братья Мясниковы стали героями судебного разбирательства, которое тянулось 14 лет и в которое будут вовлечены огромное количество людей. Оно сопровождалось тёмными слухами и домыслами. Эта тяжба довела одного брата до инсульта и ранней могилы, а другой лишился блестяще начатой карьеры и уважения в обществе. Само же «Дело Мясниковых» прогремело на всю страну и применялось в качестве примера для обучения молодых юристов.

Во время иммерсивного спектакля ты пройдёшься по парадным залам и гостиным, хранящим почти 200 лет истории, узнаешь тайную наследства братьев Мясниковых и лично увидишь, как проходило судебное разбирательство.",theater,,,19 июля 2026,,Особняк И. Мясникова,"ул. Восстания, 45",,,2200,от 2200 ₽,False,16+,,https://kaverafisha.ru/saint-petersburg/events/spektakl-promenad-tayyny-nasledstva-bratev-myasnikovyh-315646,kaver,2026-07-14 14:54:20
,Спектакль Красотка и семья,Спектакль Красотка и семья,"Забавная комедия, которая подарит тебе вечер, полный смеха и хорошего настроения. Пьеса Сомерсета Моэма переносит зрителей в мир остроумных диалогов и неожиданных сюжетных поворотов.

В центре истории — семья, в которой очаровательная и непредсказуемая «красотка», вызывает целую череду комичных ситуаций, раскрывает скрытые черты характера героев и обнажает противоречия, таящиеся за фасадом благополучия.

Каждый персонаж — словно яркий калейдоскоп человеческих страстей, слабостей. Остроумные реплики, ироничные отсылки к повседневным ситуациям и неожиданные сюжетные ходы не дадут тебе заскучать и будут держать в напряжении до самого финала.

Эта постановка — отличный способ отвлечься от рутины и насладиться лёгким, но в то же время увлекательным театральным представлением. Ты не только посмеёшься от души, но и, возможно, взглянешь под новым углом на некоторые привычные вещи.",theater,,,19 июля 2026,,,,,,700,от 700 ₽,False,16+,,https://kaverafisha.ru/saint-petersburg/events/krasotka-i-semya-312474,kaver,2026-07-14 14:54:22
,Спектакль Монро: ненормальная!,Спектакль Монро: ненормальная!,"Кем была Мэрилин Монро? Самой известной актрисой 20-го века? Иконой стиля для женщин и мечтой миллионов мужчин? Расчётливой холодной блондинкой или глупышкой с голливудской улыбкой и наивными мечтами? Она сводила с ума каждого встречного, имела оглушительную популярность и... оставалась загадкой даже для самой себя.

Что происходило за закрытой дверью, куда не попадали папарацци? Почему эта жизнерадостная на хрониках женщина оказалась в психиатрической больнице? Почему она сама ненавидела Мэрилин Монро?
Кем была Мэрилин Монро? И была ли она вообще?

Продолжительность – 1 час 15 минут без антракта.",theater,,,23 июля 2026,,GAiKA SPACE,"Ул. Черняховского, 75",,,2150,от 2150 ₽,False,18+,,https://kaverafisha.ru/saint-petersburg/events/monro-nenormalnaya-271939,kaver,2026-07-14 14:54:25
,Спектакль Идиот,Спектакль Идиот,"Моноспектакль.

Роман Достоевского «Идиот» — как и вся подлинная классика — существует вне времени и рассказывает нам о нас же самих — сегодняшних зрителях, сидящих в зале.

Одна из центральных тем постановки — любовь во всех её проявлениях. Любовь как испытание. Любовь как приговор. Любовь как последняя надежда и спасение.

Моноспектакль «Идиот» не даёт готовых ответов — он задаёт вопросы, от которых невозможно уклониться.",theater,,,25 июля 2026,,Курт,"ул. Чайковского, 16",,,2200,от 2200 ₽,False,16+,,https://kaverafisha.ru/saint-petersburg/events/idiot-315418,kaver,2026-07-14 14:54:27
,Спектакль Человек из Подольска,Спектакль Человек из Подольска,"Простой парень из подмосковного городка попадает в полицию. Он думает, что это недоразумение. И ждёт, когда его отпустят. Однако полицейские не спешат. Они хотят узнать о нем всё, залезть в тайные уголки его души и понять, почему этот подольский человек не видит ничего вокруг себя и живёт как автомат. 

Допрашивая, они не прибегают к силовым методам, используют новые методики. Полицейские ли они или некое особое подразделение по работе с населением? Можно ли с помощью интеллектуального насилия изменить человека в лучшую сторону или такой путь ведет в тупик? Эти вопросы задают авторы спектакля, и ответ придёт в финале. 

Обыденная ситуация допроса превращается в многослойное психологическое расследование, парадоксальный детектив, изощрённый сеанс психотерапии. Пришедший в театр зритель начнёт вместе с героями спектакля — думать. О своём предназначении в мире, о свободе, о любви к Родине. И обязательно понадобится большое чувство юмора, потому что это просто необходимо — суметь открыто посмотреть вокруг, на себя, улыбнуться и в то же время задуматься.",theater,,,3 августа 2026,,Театр «На Литейном»,,,,1800,от 1800 ₽,False,18+,,https://kaverafisha.ru/saint-petersburg/events/chelovek-iz-podolska-317208,kaver,2026-07-14 14:54:29
,Спектакль Болезни молодости,Спектакль Болезни молодости,"Как пережить болезни молодости и не потерять себя? Ответ на этот вопрос ищут герои спектакля «Болезни молодости» вместе с актёрами Театра Поколений. 

Русской публике представлено одно из крупнейших драматургических имен Европы – Фердинанд Брукнер. Пьесу «Болезни молодости» в России никогда не ставили, она переведена на русский язык специально для Театра Поколений. Это первая пьеса из цикла, состоящего из шести пьес о судьбах немецкой молодёжи, которые Брукнер писал на протяжении всей своей жизни.

1923 год. Австрия после Первой мировой войны. Крах и разочарование в обществе, пережившем колоссальный кризис. Мир перевернулся, происходит непоправимое, что-то ушло вперед, что-то навсегда осталось позади. XIX век закончился разрушением великой гуманистической цивилизации. Что будет дальше — никто не знает. Герои пьесы, молодые студенты-медики, пытаются найти себя и свое место в жизни в то время, когда в Германии уже готовится прийти к власти Адольф Гитлер.

Новый театральный язык, которым режиссёр беседует через свои спектакли со зрителями, многих удивил, шокировал, но не оставил равнодушными.

В спектакле звучит музыка Джузеппе Верди, Рихарда Вагнера, Збигнева Прайснера, Дюка Эллингтона, группы «Инк Спотс», Кинга Оливера, Дмитрия Шостаковича.",theater,,Студентам,4 августа 2026,,Театр Поколений,,,,1500,от 1500 ₽,False,18+,,https://kaverafisha.ru/saint-petersburg/events/bolezni-molodosti-254404,kaver,2026-07-14 14:54:31
,Спектакль Вий,Спектакль Вий,"Спектакль-карнавал в жанре фолк-триллера, в котором каждый образ – само воплощение бесстыдных желаний, потаенных страстей, эротики и глубоких заблуждений.

Летней ночью в поисках ночлега трое семинаристов забредают в гости к двуликой ведьме, вторая личина который — панночка невиданной красоты. Еле унеся ноги от колдуньи, главный герой — философ Хома Брут попадает в смертельное приключение.

Ему предстоит провести ровно три ночи у гроба красавицы, лицом к лицу с нечистой силой, балансируя на грани жизни и смерти. Хватит ли Бруту сил уцелеть в схватке с нежитью?

Продолжительность – 2 ч 30 мин (с антрактом).

Касса театра и заказ билетов:
+7 (812) 310-33-09 (доб. 301)",theater,,,7 августа 2026,,Приют комедианта,,,,800,от 800 ₽,False,18+,,https://kaverafisha.ru/saint-petersburg/events/viyy-256249,kaver,2026-07-14 14:54:33
,Спектакль Киса,Спектакль Киса,"Что ты знаешь о Кисе Воробьянинове? Наверняка, что этот разжалованный новой властью предводитель дворянства бежал в крохотный город и прятался у тещи. Что от нее узнал тайну о брильянтах в одном из двенадцати стульев и отправился на их поиски вместе с великим комбинатором Остапом Бендером.

Но это только часть его биографии. Истинная личность Кисы, его характер и приключения были безжалостно вырезаны из романа советской цензурой. Запрещенные главы рассказывают, что, оказывается, этот почтенный старец — мот и бонвиван похлеще Бендера. И поиск фамильных ценностей — его последний шанс вернуться к непрерывному кутежу.

Именно об этом, настоящем, Кисе новый спектакль Семена Серзина — одного из лидеров российской режиссуры, известного зрителям «Приюта комедианта» по спектаклю «Смерть Тарелкина».

Продолжительность – 2 ч 30 мин (с антрактом).",theater,,,10 августа 2026,,Приют комедианта,,,,800,от 800 ₽,False,18+,,https://kaverafisha.ru/saint-petersburg/events/kisa-267098,kaver,2026-07-14 14:54:35
