external_id,title,short_title,description,category,tags,start_datetime,end_datetime,venue_title,venue_address,venue_lat,venue_lon,price_min,price_raw,is_free,age_restriction,image_url,site_url,source,parsed_at
,Так не бывает,Так не бывает,"Совместный проект Сообщества Современных Сибирских Художников и творческого объединения «Тоска». По итогам опен-колла для участия в выставке было отобрано 50 художников в составе 18 коллективов из разных городов России. Выставка исследует ментальные основы переходного поколения Y–Z и обращается к субъективному опыту представителей «потерянного поколения» через их ранние впечатления, значимые воспоминания и наивные мечты о будущем.

Люди не помнят детство последовательно, его чувствуют словно во сне: сквозь дымку сладкой ваты, утраченного доверия и чувства «дома». В основу выставки легли не только воспоминания, но и «сны» — уникальные высказывания художественных объединений, как уже существующих, так и созданных специально для проекта. Результатом исследования стала экспозиция нескольких десятков «снов» объединений и индивидуальных художников. Их работы существуют независимо или же перекликаясь между собой и взаимодействуя с индустриальным пространством Фабрики, дополняя его и становясь",other,,"Выставка Так не бывает в городе Санкт-Петербург, до 26 июля 2026: купить билеты — Кавёр",,,,,,400,400 руб,False,0+,https://kaverafisha.ru/__og-image__/image/saint-petersburg/events/tak-ne-byvaet-315145/og.png,https://kaverafisha.ru/saint-petersburg/events/tak-ne-byvaet-315145,kaver,2026-07-11 14:04:08
,Ночной Стендап,Ночной Стендап,"Ночная комедия: классные комики рассказывают шутки в баре в центре города. С тебя — прийти, с комиков — хорошее настроение и вкусные напитки с едой.

Запуск на мероприятие за полчаса до начала.
Рассадка осуществляется менеджером зала в порядке очереди.
Приходи к началу запуска, чтобы занять места ближе к сцене.",stand-up,,"Ночной Стендап в городе Санкт-Петербург, 11 июля 2026: купить билеты — Кавёр",,,,,,700,700 руб,False,0+,https://kaverafisha.ru/__og-image__/image/saint-petersburg/events/nochnoyy-standup-295734/og.png,https://kaverafisha.ru/saint-petersburg/events/nochnoyy-standup-295734,kaver,2026-07-11 14:04:10
,Вселенная голосов: музыкальное шоу Юlайк,Вселенная голосов: музыкальное шоу Юlайк,"Мировые хиты Queen, Evanescence, Celine Dion, АИГЕЛ, Sting и многих других легендарных исполнителей  прозвучат в завораживающих многоголосных аранжировках на фоне космических пейзажей. 

Через красивое музыкальное повествование погрузишься в исследование себя и космоса и ответят на вопрос: что общего между космическими явлениями и человеческими чувствами.

Группа Юlайк (U Like), созданная в Санкт-Петербурге в мае 2013 года, — это настоящий оркестр из пяти женских голосов, исполняющий современные акапелла-композиции в авторских аранжировках. Одна из лучших акапелла-групп мира.",concert,,"Вселенная голосов: музыкальное шоу Юlайк в городе Санкт-Петербург, 17 июля 2026: купить билеты — Кавёр",,,,,,1500,1500 руб,False,0+,https://kaverafisha.ru/__og-image__/image/saint-petersburg/events/vselennaya-golosov-muzykalnoe-shou-yulayyk-316634/og.png,https://kaverafisha.ru/saint-petersburg/events/vselennaya-golosov-muzykalnoe-shou-yulayyk-316634,kaver,2026-07-11 14:04:12
,Красотка и семья,Красотка и семья,"Забавная комедия, которая подарит тебе вечер, полный смеха и хорошего настроения. Пьеса Сомерсета Моэма переносит зрителей в мир остроумных диалогов и неожиданных сюжетных поворотов.

В центре истории — семья, в которой очаровательная и непредсказуемая «красотка», вызывает целую череду комичных ситуаций, раскрывает скрытые черты характера героев и обнажает противоречия, таящиеся за фасадом благополучия.

Каждый персонаж — словно яркий калейдоскоп человеческих страстей, слабостей. Остроумные реплики, ироничные отсылки к повседневным ситуациям и неожиданные сюжетные ходы не дадут тебе заскучать и будут держать в напряжении до самого финала.

Эта постановка — отличный способ отвлечься от рутины и насладиться лёгким, но в то же время увлекательным театральным представлением. Ты не только посмеёшься от души, но и, возможно, взглянешь под новым углом на некоторые привычные вещи.",other,,"Спектакль Красотка и семья в городе Санкт-Петербург, 19 июля 2026: купить билеты — Кавёр",,,,,,700,700 руб,False,0+,https://kaverafisha.ru/__og-image__/image/saint-petersburg/events/krasotka-i-semya-312474/og.png,https://kaverafisha.ru/saint-petersburg/events/krasotka-i-semya-312474,kaver,2026-07-11 14:04:14
,Шаманский саундхиллинг-погружение,Шаманский саундхиллинг-погружение,"Телесно-энергетическая практика по раскрытию голоса.

Путешествие в мир голоса, спонтанного звучания и живой проявленности — в этом прекрасном, таком разном мире, среди таких же прекрасных, разных людей.

Ведущие — Светлана и Иван.

Ты начнёшь со Светиной магии: она расскажет тебе, покажет, поддержит и поможет, а Иван сопроводит древними звуками. 

Всё прозвучит, а после все прилягут и погрузятся в глубокие звуковые потоки.

Оплата: любая сумма на входе.",other,,"Шаманский саундхиллинг-погружение в городе Санкт-Петербург, 13 июля 2026: купить билеты — Кавёр",,,,,,1,1 руб,False,0+,https://kaverafisha.ru/__og-image__/image/saint-petersburg/events/shamanskiyy-saundhilling-pogruzhenie-317206/og.png,https://kaverafisha.ru/saint-petersburg/events/shamanskiyy-saundhilling-pogruzhenie-317206,kaver,2026-07-11 14:04:19
,Трибьют фестиваль (Tribute City Fest),Трибьют фестиваль (Tribute City Fest),"Первый масштабный фестиваль, переосмысливающий творчество главных музыкальных коллективов 2000-х, Трибьют фестиваль (Tribute City Fest) возвращает посетителям их безбашенные 2000-е через творчество лучших звёзд трибьют-сцены.

Тебя ждут семь часов живой музыки в максимально идентичном звучании, незабываемая атмосфера, мощное шоу и яркие эмоции.

Участники:

Rammstein трибьют
Знаменитый трибьют из Сочи — группа RAMMproJect, покорившая сердца поклонников по всей России. Их образы не только передают дух Rammstein, но и привносят собственную уникальность. Двухчасовое шоу с пиротехникой, мощной энергетикой и невероятным артистизмом.

Linkin Park трибьют
LAAV — Профессиональный трибьют-проект из Краснодара, исполняющий главные хиты Linkin Park. Точная передача оригинального звучания — это возможность вновь пережить эмоции от любимых композиций в живом исполнении, почувствовать ту самую энергетику, которая сделала Linkin Park одной из самых влиятельных групп современности, а вокал Честера — г",festival,,"Трибьют фестиваль (Tribute City Fest) в городе Санкт-Петербург, 9 августа 2026: купить билеты — Кавёр",,,,,,1000,1000 руб,False,0+,https://kaverafisha.ru/__og-image__/image/saint-petersburg/events/tribyut-festival-tribute-city-fest-315227/og.png,https://kaverafisha.ru/saint-petersburg/events/tribyut-festival-tribute-city-fest-315227,kaver,2026-07-11 14:04:21
,Светский салон в особняке Мясникова,Светский салон в особняке Мясникова,"Особенный вечер, который перенесёт тебя во времена, когда в Особняке Мясникова традиционно устраивали светские встречи с танцами и музыкой.

В музыкальной гостиной пройдут танцевальные мастер-классы. Здесь гости разучат основные элементы парных танцев. Принять участие в мастер-классе можно как со своей второй половинкой, так и в сопровождении профессионального партнёра.

Для тех, кому не нужен мастер-класс, пройдёт танцевальная часть в концертном зале. В программе: фокстрот, вальс, танго, сальсу, бачату, самбу, свинг, ча-ча-ча. Ты также можешь приобрести специальный билет, в который входит сопровождение профессионального танцора в течение всей танцевальной части.",other,,"Светский салон в особняке Мясникова в городе Санкт-Петербург, 26 июля 2026: купить билеты — Кавёр",,,,,,3000,3000 руб,False,0+,https://kaverafisha.ru/__og-image__/image/saint-petersburg/events/svetskiyy-salon-v-osobnyake-myasnikova-266593/og.png,https://kaverafisha.ru/saint-petersburg/events/svetskiyy-salon-v-osobnyake-myasnikova-266593,kaver,2026-07-11 14:04:25
,Леонид Кулаков | 19:00,Леонид Кулаков | 19:00,"Стендап комик, продюсер, основатель лейбла и бара «Стендап Патрики». Честный, трушный юмор на актуальные события, мимо которых пройти невозможно.

Лёню смотрят, обсуждают, критикуют и восхищаются. Его сольники уже дали много шуму и немало просмотров. Но только вживую можно по-настоящему понять — кто такой Леонид Кулаков?",other,,"Леонид Кулаков | 19:00 в городе Санкт-Петербург, 15 июля 2026: купить билеты — Кавёр",,,,,,2000,2000 руб,False,0+,https://kaverafisha.ru/__og-image__/image/saint-petersburg/events/leonid-kulakov-1900-316554/og.png,https://kaverafisha.ru/saint-petersburg/events/leonid-kulakov-1900-316554,kaver,2026-07-11 14:04:27
,Отражение,Отражение,"Психологический эксперимент, где ты можешь узнать, какое впечатление ты производишь без единого слова.

О чём этот эксперимент?
Ты когда-нибудь хотел узнать, что о тебе думают другие, но без слов, без неловких объяснений, без необходимости что-то доказывать?

«Отражение» — это уникальный психологический эксперимент, где ты молча, в полной тишине, заполняешь 9 анонимных бланков. Никаких выступлений, никакого «расскажи о себе». Только твой образ, твоя поза, твой взгляд, мимика и те мельчайшие детали, которые ты носишь в себе.

Задача простая и одновременно сложная:
— Оценить других участников только по внешним, невербальным признакам
— Узнать, какое первое впечатление вы производите на незнакомых людей
— Сравнить свой внутренний мир с тем, что видят окружающие

Как это проходит?
Тишина. Никто ничего не говорит. Это главное правило. Каждый участник получает 9 бланков — на каждого присутствующего (включая себя). Ты анонимно отмечаешь свои наблюдения: характер, эмоции, черты, ассоциации. По",other,,"Отражение в городе Санкт-Петербург, 24 июля 2026: купить билеты — Кавёр",,,,,,2000,2000 руб,False,0+,https://kaverafisha.ru/__og-image__/image/saint-petersburg/events/otrazhenie-316512/og.png,https://kaverafisha.ru/saint-petersburg/events/otrazhenie-316512,kaver,2026-07-11 14:04:30
,Сказочный мир русской классики,Сказочный мир русской классики,"Волшебные образы из любимых сказок оживают на концерте в старинной Анненкирхе.

В исполнении Оркестра 1703 ты услышишь жемчужины музыкальной классики, созданные по мотивам знакомой с детства литературы: «Щелкунчик», «Сказка о царе Салтане», «Лебединое озеро», «Руслан и Людмила». 

Выступление украсят медиапроекции с образами волшебных героев, городов, пейзажей. Визуальное оформление с авторскими иллюстрациями выполнено Русланом Назыровым и вдохновлено творчеством известных художников начала ХХ века.",other,,"Выставка Сказочный мир русской классики в городе Санкт-Петербург, 11 июля 2026: купить билеты — Кавёр",,,,,,1700,1700 руб,False,0+,https://kaverafisha.ru/__og-image__/image/saint-petersburg/events/skazochnyy-mir-russkoyy-klassiki-v-annenkirhe-272842/og.png,https://kaverafisha.ru/saint-petersburg/events/skazochnyy-mir-russkoyy-klassiki-v-annenkirhe-272842,kaver,2026-07-11 14:04:32
,Магия свечей. «Эми Уайнхаус. Джаз на крыше»,Магия свечей. «Эми Уайнхаус. Джаз на крыше»,"В этот вечер под куполом панорамного пространства для тебя прозвучит проникновенный и томный джаз, наполняя пространство эмоциями легендарной Эми Уайнхаус.

В сиянии сотен свечей ты услышишь её культовые хиты: «Rehab», «Tears Dry On Their Own», «Back To Black» и другие композиции, ставшие голосом целого поколения.

Эми пела на пределе чувств — и именно это сделало её легендой. Хриплый, пронзительный тембр, абсолютная искренность и смелость превращать личные переживания в искусство навсегда изменили звучание современной музыки.

На сцене — харизматичная Анастасия Сазонова и Jazz Noir Band. Их исполнение — это не просто трибьют, а живая, глубокая интерпретация: с нотами соула, ритм-энд-блюза и той самой эмоциональной честностью, за которую любят Эми. Каждая композиция здесь — как откровение.

А за панорамными окнами — вечерний Петербург: огни города, сияние Исаакиевского собора и устремлённая ввысь башня «Лахта Центра». 

Внимание! Вход гостей — в 20:00

Пространство расположено на крыше",other,,"Магия свечей. «Эми Уайнхаус. Джаз на крыше» в городе Санкт-Петербург, 17 июля 2026: купить билеты — Кавёр",,,,,,3300,3300 руб,False,0+,https://kaverafisha.ru/__og-image__/image/saint-petersburg/events/magiya-svecheyy-amy-winehouse-jaz-na-kryshe-316666/og.png,https://kaverafisha.ru/saint-petersburg/events/magiya-svecheyy-amy-winehouse-jaz-na-kryshe-316666,kaver,2026-07-11 14:04:34
,Фестиваль электронной хаус музыки,Фестиваль электронной хаус музыки,"Фестиваль электронной хаус музыки от LFD Promo Group. В этом уникальном месте тебя ждут самые 2 танцпола. Просторная терраса крыши Питерленд с захватывающим видом на залив, крытый ресторан с танцполом на 1000 человек.

Вся площадка вмещает 2000 человек, предлагая множество вариантов для отдыха и развлечений. В случае непогоды все вместятся под крышу.",other,,"Фестиваль электронной хаус музыки в городе Санкт-Петербург, 11 июля 2026: купить билеты — Кавёр",,,,,,1500,1500 руб,False,0+,https://kaverafisha.ru/__og-image__/image/saint-petersburg/events/open-air-272733/og.png,https://kaverafisha.ru/saint-petersburg/events/open-air-272733,kaver,2026-07-11 14:04:36
,Съёмки «Абушоу» | 16:00,Съёмки «Абушоу» | 16:00,"Мероприятие, на котором Нидаль Абу-Газале берёт истории людей из зала, и, благодаря его разгонам, ты можешь наблюдать как комедия рождается прямо на сцене.",other,,"Съёмки «Абушоу» | 16:00 в городе Санкт-Петербург, 12 июля 2026: купить билеты — Кавёр",,,,,,3500,3500 руб,False,0+,https://kaverafisha.ru/__og-image__/image/saint-petersburg/events/semki-abushou-1600-316852/og.png,https://kaverafisha.ru/saint-petersburg/events/semki-abushou-1600-316852,kaver,2026-07-11 14:04:38
,КвАРТал. Вечный маркет,КвАРТал. Вечный маркет,"Площадка, где объединили мастеров разных творческих направлений со всей России, желающих реализовать свой творческий потенциал.

Это вечный маркет с еженедельной сменой участников, в прекрасном месте Севкабель Порт рядом с Финским заливом.

Что здесь можно найти? Локальные hand made бренды и работы деятелей искусства различных категорий: одежды, аксессуаров, украшений, изделий из керамики, натуральной косметики, игрушек и многого другого.

Каждый день с 11:00 до 22:00",other,,"КвАРТал. Вечный маркет в городе Санкт-Петербург, до 31 августа 2026: купить билеты — Кавёр",,,,,,0,Бесплатно,True,0+,https://kaverafisha.ru/__og-image__/image/saint-petersburg/events/kvartal-vechnyy-market-286946/og.png,https://kaverafisha.ru/saint-petersburg/events/kvartal-vechnyy-market-286946,kaver,2026-07-11 14:04:41
,Булгаков. Мастер и Маргарита,Булгаков. Мастер и Маргарита,"Литературная встреча-разговор по мотивам произведений М.А.Булгакова.

Бессмертное, загадочное и остроумное «Евангелие от Сатаны» Михаила Булгакова.
Роман, уникальный в российской литературе ХХ столетия. Трудно себе представить, какое влияние он оказал на мировую культуру.

Чем же заворожила история о дьяволе и его свите, почтивших своим присутствием Москву 1930-х, о прокураторе Иудеи всаднике Понтии Пилате и нищем философе Иешуа Га-Ноцри, о талантливом и несчастном Мастере и его прекрасной и верной возлюбленной Маргарите?

Читает Антон Тарасов.",education,,"Выставка Булгаков. Мастер и Маргарита в городе Санкт-Петербург, 14 июля 2026: купить билеты — Кавёр",,,,,,600,600 руб,False,0+,https://kaverafisha.ru/__og-image__/image/saint-petersburg/events/bulgakov-master-i-margarita-315957/og.png,https://kaverafisha.ru/saint-petersburg/events/bulgakov-master-i-margarita-315957,kaver,2026-07-11 14:04:43
